{
  "iso3": "CIV",
  "label": null,
  "x_viz": [
    -1.18543573542749,
    -0.3866162808683997
  ],
  "x_viz_ellipse": {
    "sigma": [
      [
        0.23293692755710943,
        0.0
      ],
      [
        0.0,
        0.4196998620067553
      ]
    ],
    "confidence_level": 0.8,
    "source": "imputed_pew"
  },
  "x_score": [
    64.91416364540243,
    27.309872155503466,
    54.01021378762552,
    44.60107337897211,
    30.6318368281882,
    43.78197718061572
  ],
  "affinity_vector": {
    "western": 0.034484310991275254,
    "orthodox": 0.02121090371770222,
    "islamic": 0.16841600043636312,
    "sinic": 0.06632505390266714,
    "hindic": 0.11078574379704509,
    "japanese": 0.008557317741603523,
    "buddhist": 0.11732611764258732,
    "latin_american": 0.058419130374796416,
    "african": 0.2135975732640219,
    "indigenous": 0.05753345219976105,
    "oceanian": 0.14334439593217696
  },
  "data_quality": {
    "iw_coverage": "missing",
    "hofstede_coverage": "missing",
    "low_evidence": true,
    "x_viz_provenance": "imputed_pew",
    "x_score_provenance": "imputed_governance",
    "x_score_sigma_prior": [
      12.89482013219045,
      16.654266762366433,
      17.276090153261453,
      19.840361952573588,
      23.703391973204358,
      22.027751828622787
    ],
    "fallback_civilization_id": "islamic",
    "pew_to_iw_model": {
      "training_n": 93,
      "rmse_ts": 0.4826353981600494,
      "rmse_se": 0.647842466967669
    },
    "governance_to_hofstede_model": {
      "training_n": 63,
      "rmse_per_dimension": {
        "pdi": 12.89482013219045,
        "idv": 16.654266762366433,
        "mas": 17.276090153261453,
        "uai": 19.840361952573588,
        "lto": 23.703391973204358,
        "ivr": 22.027751828622787
      }
    }
  },
  "source_refs": [
    "pew_religious_composition_2020",
    "wgi_2022",
    "fsi_2024"
  ],
  "curated_civilization": null,
  "curated_role": "ambiguous",
  "curated_civilizations_competing": [
    "islamic",
    "african"
  ],
  "sub_cluster_id": null,
  "sub_cluster_label": null
}